Title,Takeaway,Authors,Year,Citations,Abstract,Study Type,Journal,Journal SJR Quartile,DOI,Consensus Link
"Association Between Cognitive Abilities and Chess Skills in Children: A Systematic Review","Chess training in children 5-12 years old promotes cognitive development, particularly in intelligence, visual-spatial abilities, and mathematical problem-solving skills.","Anastasia Yakushina, Ekaterina E. Vasukova, Aleksandra G. Dolgikh",2025,0,"Background. Children’s success in school requires a high level of cognitive abilities. Chess training, the popularity of which among children is growing, can help promote cognitive development. Research on the relationship between cognitive abilities and chess skills is becoming relevant, especially in the view of the recommendations for the integration of chess into educational programmes for children. However, research findings on the relationship between chess skills and cognitive ability are inconsistent. 
Objectives. The aim of the current work was to classify and systematize empirical studies aimed at investigating the relationship between cognitive abilities and chess training in children 5–12 years old.
Methods. A literature review was conducted using the PRISMA method. 273 English-language and 90 Russian-language articles corresponding to the search query were found. As a result of screening and selection, 18 studies were included in further qualitative analysis. 
Results. Two main approaches to studying the relationship between chess classes and cognitive abilities in children were identified in the analysis: general cognitive abilities and special cognitive abilities. It was shown that children who attend additional chess classes have higher levels of intelligence and visual-spatial abilities. In addition, teaching children chess promotes the development of mathematical problem solving and mental numeracy skills in schoolchildren. However, there has been a lack of research on the relationship between chess lessons and regulatory functions in children, despite the significant predictive value of these cognitive abilities. 
Conclusions. The conducted theoretical review demonstrated the significance of chess in children's cognitive development, on the one hand; and, on the other hand, allowed us to outline the prospects for further research in this area, in order to obtain reliable and less ambiguous results. The materials of the article can be useful for planning research in the field of child development and educational psychology.","","National Psychological Journal","","10.11621/npj.2025.0306","https://consensus.app/papers/association-between-cognitive-abilities-and-chess-skills-yakushina-vasukova/77404477109553f4b271e45f7148d0b8/"
"Chess training for improving executive functions and invasion game tactical behavior of college student athletes: a preliminary investigation","Chess training can improve executive functions and tactical game behaviors in college student athletes, potentially enhancing their team sport performance.","A. Dania, Kalliope Kaltsonoudi, Ioannis E Ktistakis, Konstantina Trampa, Niki Boti, C. Pesce",2021,4,"ABSTRACT 
 Background
 Within team sports, players’ ability to inhibit inappropriate behavioral responses and flexibly adapt to upcoming challenges relates significantly to their game performance. As such, there have been calls for cognitively fostering programs to form the basis of game teaching and coaching practice. However, only few studies have tested so far the effects of purposefully designed perceptual-cognitive interventions on players’ tactical performance. 
 Purpose
 The purpose of this study was to evaluate whether a chess-based intervention designed to train invasion-game athletes’ executive functions (EFs) could positively impact their tactical game behaviors. 
 Methods
 Twenty-six invasion-game athletes, 19 to 20 years old (M = 20.58, SD = 1.74) participated in the study and were randomly assigned to a chess group (ChG) (n = 13) and a control group (CG) (n = 13). The ChG participated in a 10-week chess training program designed to foster EFs, while the CG received no special treatment. Pre-and-post measures were completed using: (a) core EF tests and (b) the game performance assessment instrument. 
 Results
 After the intervention, the ChG group showed improvement in working memory and selective attention (cool EFs; higher memory span, fewer errors on incongruent stimuli), as well as decision-making and flexibility in passing (tactical behaviors; more appropriate passes, variety in passes), whereas no such changes were recorded for the CG. Further, there were no differential changes in cognitive flexibility and affective decision making (cool and hot EFs), as well as support, originality and fluency in passing (tactical behaviors) for the two groups as a function of time. 
 Conclusion
 By embracing the idea of situated cognition, the current study provides some initial evidence for the linkage between perceptual-cognitive training and team sport performance, suggesting that EFs – as fundamental cognitive processes – can be trained to work in conjunction with the cognitive components of game performance within sport settings. The results of this work are discussed in the context of cognitive and game teaching research, extending current knowledge and understanding of how lab-based and sport training methods can be effectively combined and delivered.","rct","Physical Education and Sport Pedagogy","1","10.1080/17408989.2021.1990245","https://consensus.app/papers/chess-training-for-improving-executive-functions-and-dania-kaltsonoudi/f44d94c1eddf5a7990c41e2ff0f74673/"
"The Effects of Chess on Cognitive Abilities and Critical Thinking of High School Students in Riyadh","Chess proficiency in high school students in Riyadh, Saudi Arabia, is associated with improved visual-spatial processing and cognitive flexibility, but may not generalize to non-domain-specific working memory tasks.","J. Darwish, Ghaith Saad, A. Maayah, O. Hassan, Abdulmalik I Alshehri, Mohammed M. Abdelrahman",2025,0,"This study investigates the relationship between chess proficiency and diverse cognitive functions in high school students in Riyadh, Saudi Arabia. While previous research has documented the benefits of chess on problem-solving, critical thinking, and memory in Western contexts, little is known about its impact within rapidly modernizing educational environments such as Riyadh. Utilizing a purposive sample of 120 tenth-grade students familiar with basic chess rules, participants completed three standardized cognitive assessments: the Trail Making Test (pattern recognition and cognitive flexibility), the Stroop Test (inhibitory control), and the Backward Digit Span (short-term working memory). Chess skill was quantified via Elo ratings ranging from 100 to 1750. Correlational analyses revealed a modest positive association between Elo and Trail Making accuracy (r = 0.215, p < .01), suggesting that higher chess expertise corresponds to superior visual-spatial processing and cognitive flexibility. The relationship between Elo and Stroop performance was weakly positive for correct responses (r = 0.055, p = .40) and negative for errors (r = – 0.177, p < .05), indicating a slight enhancement of inhibitory control among stronger players. No significant correlation emerged between Elo and Backward Digit Span scores (r = – 0.070, p = .28), implying that chess proficiency may not generalize to non-domain-specific working memory tasks. These results align with domain-specific transfer theories and underscore the multifactorial nature of cognitive skill development. Findings highlight chess as a valuable, yet targeted, tool for fostering certain executive functions in adolescents. Future research should employ longitudinal and experimental designs to establish causality and explore additional cognitive domains.","","International Journal of Academic Research in Progressive Education and Development","","10.6007/ijarped/v14-i2/25536","https://consensus.app/papers/the-effects-of-chess-on-cognitive-abilities-and-critical-darwish-saad/e3cfb15d8d4c5155b2c81d705ea56f00/"
"Does Far Transfer Exist? Negative Evidence From Chess, Music, and Working Memory Training","Chess, music, and working memory training show small to moderate effects on children's cognitive and academic skills, casting doubt on their effectiveness.","G. Sala, F. Gobet",2017,259,"Chess masters and expert musicians appear to be, on average, more intelligent than the general population. Some researchers have thus claimed that playing chess or learning music enhances children's cognitive abilities and academic attainment. We here present two meta-analyses assessing the effect of chess and music instruction on children's cognitive and academic skills. A third meta-analysis evaluated the effects of working memory training-a cognitive skill correlated with music and chess expertise-on the same variables. The results show small to moderate effects. However, the effect sizes are inversely related to the quality of the experimental design (e.g., presence of active control groups). This pattern of results casts serious doubts on the effectiveness of chess, music, and working memory training. We discuss the theoretical and practical implications of these findings; extend the debate to other types of training such as spatial training, brain training, and video games; and conclude that far transfer of learning rarely occurs.","meta-analysis","Current Directions in Psychological Science","1","10.1177/0963721417712760","https://consensus.app/papers/does-far-transfer-exist-negative-evidence-from-chess-music-sala-gobet/b14fcdf1478c5793b4e5b956d2031d0b/"
"The Multifaceted Impact of Chess: Cognitive Enhancement, Educational Applications, and Technological Innovations","Chess enhances cognitive abilities, including creativity, intelligence, and persistence, and has been used in higher education to teach computer science concepts.","Regan Yang",2025,0,"Chess is a board game that has been played throughout many centuries. Beyond the board game, it has shown its impact during the Cold War as a battle of intellect between the United States and Soviet Union. This paper reviewed research done on chess’s cognitive impacts on students and those studies have shown chess’s enhancements of cognitive abilities such as creativity, intelligence, and persistence. The technological advancements in chess engines have led to an adoption of a variety of different Artificial Intelligence (AI) and machine learning methods. Chess engines like AlphaZero and Maia have showcased techniques such as deep neural networks and human-like move prediction. Additionally, the paper explores the usage of chess in higher education where teachers have used chess as a tool to teach computer science concepts. The author suggests personalized, AI chess tutors for future development where technology, education, and chess intersect. The paper showcases the variety of influences chess has beyond the board.","literature review","Highlights in Science, Engineering and Technology","","10.54097/p0p0v281","https://consensus.app/papers/the-multifaceted-impact-of-chess-cognitive-enhancement-yang/c94063ca3f2654ef98d4a04bdbd60aae/"
